"Story","Title","Result","Date","Stability","Duration (s)"
"Driver on-boarding","Create new driver","SUCCESS","2019-09-20T11:17:32.371+07:00[Asia/Ho_Chi_Minh]","0.0","93.51"
"Hydra - Hybrid order on app","Full flow hybrid order happy case with one driver","SUCCESS","2019-09-20T11:19:05.889+07:00[Asia/Ho_Chi_Minh]","0.0","127.05"
"Hydra - Hybrid order on app","Full flow hybrid order happy case with multiple driver","SUCCESS","2019-09-20T11:21:12.947+07:00[Asia/Ho_Chi_Minh]","0.0","207.72"
"Hydra - Marketplace order on app","Driver should be able to bidding new order when drivers of this order reject new offer","SUCCESS","2019-09-20T11:24:40.673+07:00[Asia/Ho_Chi_Minh]","0.0","116.12"
"Hydra - Marketplace order on app","Full flow marketplace order happy case with multiple drivers","SUCCESS","2019-09-20T11:26:36.798+07:00[Asia/Ho_Chi_Minh]","0.0","161.97"
"Hydra - Marketplace order on ops tool","Full flow marketplace order happy case","SUCCESS","2019-09-20T11:29:18.78+07:00[Asia/Ho_Chi_Minh]","0.0","113.14"
