"Story","Title","Result","Date","Stability","Duration (s)"
"Driver on-boarding","Create new driver","SUCCESS","2019-10-04T08:33:46.464Z[GMT]","0.0","76.7"
"Hydra - Hybrid order on app","Full flow hybrid order happy case with one driver","SUCCESS","2019-10-04T08:35:03.185Z[GMT]","0.0","102.34"
"Hydra - Hybrid order on app","Full flow hybrid order happy case with multiple driver","SUCCESS","2019-10-04T08:36:45.546Z[GMT]","0.0","173.52"
"Hydra - Marketplace order on app","Driver should be able to bidding new order when drivers of this order reject new offer","SUCCESS","2019-10-04T08:39:39.094Z[GMT]","0.0","89.27"
"Hydra - Marketplace order on app","Full flow marketplace order happy case with multiple drivers","SUCCESS","2019-10-04T08:41:08.374Z[GMT]","0.0","130.56"
"Hydra - Marketplace order on ops tool","Full flow marketplace order happy case","SUCCESS","2019-10-04T08:43:18.944Z[GMT]","0.0","99.04"
"Hydra - Marketplace order on ops tool","Full flow marketplace order happy case with multiple drivers","SUCCESS","2019-10-04T08:44:57.997Z[GMT]","0.0","114.9"
