"Story","Title","Result","Date","Stability","Duration (s)"
"Driver on-boarding","Create new driver","SUCCESS","2019-10-04T08:18:02.15Z[GMT]","0.0","120.2"
"Hydra - Hybrid order on app","Full flow hybrid order happy case with one driver","SUCCESS","2019-10-04T08:20:02.39Z[GMT]","0.0","109.19"
"Hydra - Hybrid order on app","Full flow hybrid order happy case with multiple driver","SUCCESS","2019-10-04T08:21:51.596Z[GMT]","0.0","192.37"
"Hydra - Marketplace order on app","Driver should be able to bidding new order when drivers of this order reject new offer","SUCCESS","2019-10-04T08:25:03.979Z[GMT]","0.0","92.55"
"Hydra - Marketplace order on app","Full flow marketplace order happy case with multiple drivers","SUCCESS","2019-10-04T08:26:36.543Z[GMT]","0.0","129.65"
"Hydra - Marketplace order on ops tool","Full flow marketplace order happy case","SUCCESS","2019-10-04T08:28:46.213Z[GMT]","0.0","85.61"
"Hydra - Marketplace order on ops tool","Full flow marketplace order happy case with multiple drivers","SUCCESS","2019-10-04T08:30:11.834Z[GMT]","0.0","133.4"
