"Story","Title","Result","Date","Stability","Duration (s)"
"Hydra - Hybrid order on app","Full flow hybrid order happy case with one driver","SUCCESS","2019-09-27T04:53:44.443Z[GMT]","0.0","90.28"
"Hydra - Hybrid order on app","Full flow hybrid order happy case with multiple driver","SUCCESS","2019-09-27T04:55:14.735Z[GMT]","0.0","147.32"
"Hydra - Marketplace order on app","Driver should be able to bidding new order when drivers of this order reject new offer","SUCCESS","2019-09-27T04:57:42.071Z[GMT]","0.0","78.48"
"Hydra - Marketplace order on app","Full flow marketplace order happy case with multiple drivers","SUCCESS","2019-09-27T04:59:00.558Z[GMT]","0.0","114.62"
"Hydra - Marketplace order on ops tool","Full flow marketplace order happy case","SUCCESS","2019-09-27T05:00:55.185Z[GMT]","0.0","77.22"
"Hydra - Marketplace order on ops tool","Full flow marketplace order happy case with multiple drivers","SUCCESS","2019-09-27T05:02:12.419Z[GMT]","0.0","111.1"
