"Story","Title","Result","Date","Stability","Duration (s)"
"Hydra - Hybrid order on app","Full flow hybrid order happy case with one driver","SUCCESS","2019-10-02T04:18:19.364Z[GMT]","0.0","101.72"
"Hydra - Hybrid order on app","Full flow hybrid order happy case with multiple driver","SUCCESS","2019-10-02T04:20:01.107Z[GMT]","0.0","160.19"
"Hydra - Marketplace order on app","Driver should be able to bidding new order when drivers of this order reject new offer","SUCCESS","2019-10-02T04:22:41.326Z[GMT]","0.0","84.49"
"Hydra - Marketplace order on app","Full flow marketplace order happy case with multiple drivers","SUCCESS","2019-10-02T04:24:05.835Z[GMT]","0.0","123.8"
"Hydra - Marketplace order on ops tool","Full flow marketplace order happy case","SUCCESS","2019-10-02T04:26:09.663Z[GMT]","0.0","84.09"
"Hydra - Marketplace order on ops tool","Full flow marketplace order happy case with multiple drivers","SUCCESS","2019-10-02T04:27:33.762Z[GMT]","0.0","118.1"
