"Story","Title","Result","Date","Stability","Duration (s)"
"Hydra - Hybrid order on app","Full flow hybrid order happy case with one driver","SUCCESS","2019-09-26T17:08:06.409+07:00[Asia/Ho_Chi_Minh]","0.0","126.05"
"Hydra - Hybrid order on app","Full flow hybrid order happy case with multiple driver","SUCCESS","2019-09-26T17:10:12.468+07:00[Asia/Ho_Chi_Minh]","0.0","205.31"
"Hydra - Marketplace order on app","Driver should be able to bidding new order when drivers of this order reject new offer","SUCCESS","2019-09-26T17:13:37.782+07:00[Asia/Ho_Chi_Minh]","0.0","117.36"
"Hydra - Marketplace order on ops tool","Full flow marketplace order happy case","SUCCESS","2019-09-26T17:16:29.544+07:00[Asia/Ho_Chi_Minh]","0.0","111.71"
"Hydra - Marketplace order on ops tool","Full flow marketplace order happy case with multiple drivers","SUCCESS","2019-09-26T17:18:21.261+07:00[Asia/Ho_Chi_Minh]","0.0","159.61"
