"Story","Title","Result","Date","Stability","Duration (s)"
"Driver on-boarding","Create new driver","SUCCESS","2019-09-19T16:07:55.145+07:00[Asia/Ho_Chi_Minh]","0.0","100.02"
"Hydra - Hybrid order on app","Full flow hybrid order happy case with one driver","SUCCESS","2019-09-19T16:09:35.184+07:00[Asia/Ho_Chi_Minh]","0.0","136.12"
"Hydra - Hybrid order on app","Full flow hybrid order happy case with multiple driver","SUCCESS","2019-09-19T16:11:51.31+07:00[Asia/Ho_Chi_Minh]","0.0","236.9"
"Hydra - Marketplace order on app","Driver should be able to bidding new order when drivers of this order reject new offer","SUCCESS","2019-09-19T16:15:48.216+07:00[Asia/Ho_Chi_Minh]","0.0","116.62"
"Hydra - Marketplace order on app","Full flow marketplace order happy case with multiple drivers","FAILURE","2019-09-19T16:17:44.84+07:00[Asia/Ho_Chi_Minh]","0.0","19.06"
"Hydra - Marketplace order on ops tool","Full flow marketplace order happy case","FAILURE","2019-09-19T16:18:04.024+07:00[Asia/Ho_Chi_Minh]","0.0","12.87"
"Hydra - Marketplace order on ops tool","Full flow marketplace order happy case with multiple drivers","FAILURE","2019-09-19T16:18:16.898+07:00[Asia/Ho_Chi_Minh]","0.0","14.94"
